,id,created_time,text,source,favorite_count,retweet_count,username
2444,738449664752553984,2016-06-02 19:18:14,Bad performance by Crooked Hillary Clinton! Reading poorly from the telepromter! She doesn't even look presidential!,Twitter for Android,23668,7722,realDonaldTrump
2445,738448988517453824,2016-06-02 19:15:33,Crooked Hillary no longer has credibility - too much failure in office. People will not allow another four years of incompetence!,Twitter for Android,20541,6773,realDonaldTrump
2446,738416510092357632,2016-06-02 17:06:29,"Crooked Hillary Clinton, who I would love to call Lyin' Hillary, is getting ready to totally misrepresent my foreign policy positions.",Twitter for Android,15433,5190,realDonaldTrump
2447,738415541203832832,2016-06-02 17:02:38,"After the litigation is disposed of and the case won, I have instructed my execs to open Trump U(?), so much interest in it! I will be pres.",Twitter for Android,10034,2923,realDonaldTrump
2448,738413456118841345,2016-06-02 16:54:21,"Even though I have a very biased and unfair judge in the Trump U civil case in San Diego, I have thousands of great reviews &amp; will win case!",Twitter for Android,10903,2999,realDonaldTrump
2449,738412068181676032,2016-06-02 16:48:50,"With all of the Crooked Hillary Clinton's foreign policy experience, she has made so many mistakes - and I mean real monsters! No more HRC.",Twitter for Android,11737,3983,realDonaldTrump
2450,738409191526662144,2016-06-02 16:37:24,"Join me in San Jose, California- tonight!
#MakeAmericaGreatAgain #Trump2016
Tickets: https://t.co/jLQukR550J https://t.co/OrEhKJZ5Rd",Twitter for iPhone,7041,2334,realDonaldTrump
2451,738407796606013444,2016-06-02 16:31:52,"Wow, USA Today did todays cover story on my record in lawsuits. Verdict: 450 wins, 38 losses. Isn't that what you want for your president?",Twitter for Android,16409,5279,realDonaldTrump
2452,738399082813620224,2016-06-02 15:57:14,Do you ever notice that @CNN gives me very little proper representation on my policies. Just watched-nobody knew anything about my foreign P,Twitter for Android,11476,3634,realDonaldTrump
2453,738387288372051969,2016-06-02 15:10:22,Bernie Sanders was right when he said that Crooked Hillary Clinton was not qualified to be president because she suffers from BAD judgement!,Twitter for Android,17371,5306,realDonaldTrump
2454,738385522301624323,2016-06-02 15:03:21,Crooked Hillary Clinton has zero natural talent - she should not be president. Her temperament is bad and her decision making ability-zilch!,Twitter for Android,15798,5241,realDonaldTrump
2455,738236891091238913,2016-06-02 05:12:45,"""@HaloDad22: @realDonaldTrump I already voted for you! My wife did as well! I represent #Teachers4Trump! We represent #CA4Trump! #NeverDems",Twitter for Android,9073,2526,realDonaldTrump
2456,738236517949181952,2016-06-02 05:11:16,"""@SCPioneer: @stockdaleism @JamesRosenFNC @FoxNews @realDonaldTrump Not for slackers! Happy w/courses I took."" Thanks.",Twitter for Android,6782,1922,realDonaldTrump
2457,738233323344920576,2016-06-02 04:58:34,"Thank you Sacramento, California! #MakeAmericaGreatAgain https://t.co/t75Zxn9L6f",Twitter for iPhone,16240,5091,realDonaldTrump
2458,738163472865759232,2016-06-02 00:21:01,"Same failing @nytimes ""reporter"" who wrote discredited women's story last week wrote another terrible story on me today- will never learn!",Twitter for iPhone,12903,3977,realDonaldTrump
2459,738132164399636480,2016-06-01 22:16:36,Crooked Hillary Clinton is a fraud who has put the public and country at risk by her illegal and very stupid use of e-mails. Many missing!,Twitter for Android,26808,9695,realDonaldTrump
2460,738109521952833536,2016-06-01 20:46:38,"Join me in San Jose, California- tomorrow evening at 7pm! 
#MakeAmericaGreatAgain #Trump2016
https://t.co/jLQukR550J https://t.co/Uds8OdH3A4",Twitter for iPhone,9196,3216,realDonaldTrump
2461,737996614573260800,2016-06-01 13:17:58,"So I raised/gave $5,600,000 for the veterans and the media makes me look bad! They do anything to belittle - totally biased.",Twitter for Android,29296,9235,realDonaldTrump
2462,737785345459113985,2016-05-31 23:18:28,Congratulations to @seanhannity on his tremendous increase in television ratings. Speaking of ratings- I will be on his show tonight @ 10pE.,Twitter for iPhone,18188,4971,realDonaldTrump
2463,737785114239864832,2016-05-31 23:17:33,I am getting great credit for my press conference today. Crooked Hillary should be admonished for not having a press conference in 179 days.,Twitter for iPhone,21239,7020,realDonaldTrump
2464,737784398515441664,2016-05-31 23:14:42,"Katie Couric, the third rate reporter, who has been largely forgotten, should be ashamed of herself for the fraudulent editing of her doc.",Twitter for iPhone,20932,6869,realDonaldTrump
2465,737778668785766404,2016-05-31 22:51:56,I will be interviewed on @seanhannity tonight at 10pmE on @FoxNews. Enjoy!,Twitter for iPhone,9093,2342,realDonaldTrump
2466,737753549564694528,2016-05-31 21:12:07,"Join me in Sacramento, California-tomorrow evening @ 7pm! #Trump2016
https://t.co/W7xy7eXcii https://t.co/km0rRYSDnO",Twitter for iPhone,8816,3151,realDonaldTrump
2467,737689416811073536,2016-05-31 16:57:17,So many veterans groups are beyond happy with all of the money I raised/gave! It was my great honor - they do an amazing job.,Twitter for Android,19490,5497,realDonaldTrump
2468,737688582849171456,2016-05-31 16:53:58,"Just finished a press conference in Trump Tower wherein I gave information on which VETERANS groups got the $5,600,000 that I raised/gave!",Twitter for Android,18197,5383,realDonaldTrump
2469,737610159459991552,2016-05-31 11:42:20,"I have raised/given a tremendous amount of money to our great VETERANS, and have got nothing but bad publicity for doing so. Watch!",Twitter for Android,19650,5469,realDonaldTrump
2470,737596690257969152,2016-05-31 10:48:49,"So many great things happening - new poll numbers looking good! News conference at 11:00 A.M. today, Trump Tower!",Twitter for Android,14720,3930,realDonaldTrump
2471,737402123453878272,2016-05-30 21:55:41,"I should have easily won the Trump University case on summary judgement but have a judge, Gonzalo Curiel, who is totally biased against me.",Twitter for Android,14576,4032,realDonaldTrump
2472,737399475509985280,2016-05-30 21:45:09,"I have a judge in the Trump University civil case, Gonzalo Curiel (San Diego), who is very unfair. An Obama pick. Totally biased-hates Trump",Twitter for Android,13241,3789,realDonaldTrump
2473,737376803514286081,2016-05-30 20:15:04,I hope everyone had a great Memorial Day!,Twitter for Android,20914,5090,realDonaldTrump
2474,737376356795875330,2016-05-30 20:13:17,"I would have had millions of votes more in the primaries (than Crooked Hillary) if I only had one opponent, instead of sixteen. Broke record",Twitter for Android,18329,4911,realDonaldTrump
2475,737243856144629760,2016-05-30 11:26:47,Have a great Memorial Day and remember that we will soon MAKE AMERICA GREAT AGAIN!,Twitter for Android,25165,9011,realDonaldTrump
2476,737242308261842945,2016-05-30 11:20:38,"""@NBCDFW: Trump rallies veterans at annual Rolling Thunder Gathering https://t.co/b08FcMlgkr https://t.co/RCDeLvHQqD""",Twitter for Android,8910,2661,realDonaldTrump
2477,737242189055594496,2016-05-30 11:20:09,"""@FrankyLamouche: how many of donald's rolling thunder brigade will sign up and go to war for him in the middle east.""",Twitter for Android,6480,1555,realDonaldTrump
2478,737242018687164416,2016-05-30 11:19:29,"""@MariaErnandez3b: Trump Supports Rolling Thunder Rally #TRUMP STRONG https://t.co/pfVXQ8NdZu"" So true, and remember the M.I.A.'s!",Twitter for Android,14962,4110,realDonaldTrump
2479,737241411465170944,2016-05-30 11:17:04,"""@ScottWRasmussen: Donald Trump and Bikers Share Affection at Rolling Thunder Rally https://t.co/ZZl2sc29dn"" A great day in D.C.!",Twitter for Android,6946,2100,realDonaldTrump
2480,737239685295181824,2016-05-30 11:10:12,"""@TeaPartyNevada: #Trump2016 ""Illegals are taken care of better than our veterans.""  https://t.co/KKIgM4rNma https://t.co/1cEZ8wG7Cy""",Twitter for Android,9441,3432,realDonaldTrump
2481,737238518775320576,2016-05-30 11:05:34,"The endorsement of me by the 16,500 Border Patrol Agents was the first time that they ever endorsed a presidential candidate. Nice!",Twitter for Android,20884,5479,realDonaldTrump
2482,737237313034563585,2016-05-30 11:00:47,"In getting the endorsement of the 16,500 Border Patrol Agents (thank you), the statement was made that the WALL was very necessary!",Twitter for Android,14448,4155,realDonaldTrump
2483,737232540436664320,2016-05-30 10:41:49,Obama says a WALL at our southern border won't enhance our security (wrong) and yet he now wants to build a much bigger wall (fence) at W.H.,Twitter for Android,17661,6341,realDonaldTrump
2484,737056428452630528,2016-05-29 23:02:01,"If dummy Bill Kristol actually does get a spoiler to run as an Independent, say good bye to the Supreme Court!",Twitter for iPhone,15862,5898,realDonaldTrump
2485,737055532960223233,2016-05-29 22:58:27,The Republican Party has to be smart &amp; strong if it wants to win in November. Can't allow lightweights to set up a spoiler Indie candidate!,Twitter for Android,20710,6055,realDonaldTrump
2486,737054226833149952,2016-05-29 22:53:16,"Bill Kristol has been wrong for 2yrs-an embarrassed loser, but if the GOP can't control their own, then they are not a party. Be tough, R's!",Twitter for iPhone,15988,5018,realDonaldTrump
2487,737036608915034112,2016-05-29 21:43:15,Good news is that my campaign has perhaps more cash than any campaign in the history of politics- b/c I stand 100% behind everything we do.,Twitter for iPhone,19576,6019,realDonaldTrump
2488,736961734167146496,2016-05-29 16:45:44,Heading to D.C. to see and hear ROLLING THUNDER. Amazing people that LOVE OUR COUNTRY. Great spirit!,Twitter for Android,17627,4714,realDonaldTrump
2489,736875933999697920,2016-05-29 11:04:47,Honor Memorial Day by thinking of and respecting all of the great men and women that gave their lives for us and our country! We love them.,Twitter for Android,39794,14728,realDonaldTrump
2490,736672123012427776,2016-05-28 21:34:55,Does President Obama ever discuss the sneak attack on Pearl Harbor while he's in Japan? Thousands of American lives lost. #MDW,Twitter for iPhone,27069,10941,realDonaldTrump
2491,736671884247478272,2016-05-28 21:33:58,Don't believe the biased and phony media quoting people who work for my campaign. The only quote that matters is a quote from me!,Twitter for iPhone,19613,7182,realDonaldTrump
2492,736655485814857728,2016-05-28 20:28:48,"I am always on the front page of the failing @nytimes, but when I won the GOP nomination, I'm in the back of the paper. Very dishonest!",Twitter for iPhone,16990,5205,realDonaldTrump
2493,736655448993107968,2016-05-28 20:28:40,The media is on a new phony kick about my management style. I spend much less money &amp; get much better results! What we need as Prez!,Twitter for iPhone,19559,5760,realDonaldTrump
2494,736655375911530498,2016-05-28 20:28:22,"The failing @nytimes wrote a story about my management style &amp; that I don't have many people. I have 73, Hillary has 800- &amp; I'm beating her.",Twitter for iPhone,16281,5170,realDonaldTrump
2495,736569533738156036,2016-05-28 14:47:16,I (we) broke the all-time record for most votes gotten in a Republican Primary - by a lot - and with many states left to go! Thank you.,Twitter for Android,27078,7684,realDonaldTrump
2496,736554410361409536,2016-05-28 13:47:10,"The U.S. has 69 treaties with other countries where we would have to defend them and their borders. How nice, but what do we get? NOT ENOUGH",Twitter for Android,18557,6829,realDonaldTrump
2497,736441853097218048,2016-05-28 06:19:54,"Great rally in Fresno, California- great crowd! Thank you! #Trump2016 https://t.co/TVSPvxOmve",Twitter for iPhone,17421,4680,realDonaldTrump
2498,736410143378792448,2016-05-28 04:13:54,"Obama administration fails to screen Syrian refugees' social media accounts:
https://t.co/MMa07nwa44",Twitter for iPhone,10430,5034,realDonaldTrump
2499,736388616214220801,2016-05-28 02:48:22,.@SanDiegoPD- Fantastic job on handling the thugs who tried to disrupt our very peaceful and well attended rally. Greatly appreciated!,Twitter for iPhone,25527,7372,realDonaldTrump
2500,736381305785581568,2016-05-28 02:19:19,Thank you @BillyJoel- many friends just told me you gave a very kind shoutout at MSG. Appreciate it- love your music!,Twitter for iPhone,16714,4652,realDonaldTrump
2501,736336185086222336,2016-05-27 23:20:01,"Wow- 25,000 in San Diego, California!
Thank you!! #Trump2016 https://t.co/1NRj3zCuui",Twitter for iPhone,21440,7193,realDonaldTrump
2502,736336010808688640,2016-05-27 23:19:20,"I am on @oreillyfactor tonight, a big special. @FoxNews  at 8:00 P.M. ENJOY!",Twitter for Android,8273,1955,realDonaldTrump
2503,736249593352966144,2016-05-27 17:35:56,"Bill O'Reilly doing a major special on @OreillyFactor tonight- @FoxNews at 8pmE. Watch it, should be good! #Trump2016",Twitter for iPhone,10367,2963,realDonaldTrump
2504,736197797314101248,2016-05-27 14:10:07,"AN AMERICA FIRST ENERGY PLAN
#MakeAmericaGreatAgain #Trump2016
https://t.co/kTi6e1zyNI https://t.co/WjI8Rx11no",Twitter for iPhone,12742,4896,realDonaldTrump
2505,736016335197458434,2016-05-27 02:09:03,Poll data shows that @marcorubio does by far the best in holding onto his Senate seat in Florida. Important to keep the MAJORITY. Run Marco!,Twitter for Android,21833,6292,realDonaldTrump
2506,735968169001684992,2016-05-26 22:57:39,"Today we, together, won the Republican Nomination for President! https://t.co/82l6TjA2lk",Twitter Web Client,25260,8763,realDonaldTrump
2507,735959405565378560,2016-05-26 22:22:50,"My wife @MELANIATRUMP, and my children will be featured on @FoxNews with @Greta- 7pmE. Enjoy!
#MeetTheTrumps #Trump2016",Twitter for iPhone,12981,3008,realDonaldTrump
2508,735946241322799105,2016-05-26 21:30:31,"Celebrating 1237! #Trump2016 
https://t.co/hPQJc7eor0",Twitter for iPhone,13519,4328,realDonaldTrump
2509,735945699834007552,2016-05-26 21:28:22,"Thank you! #Trump2016
https://t.co/SPJfMFyPjU",Twitter for iPhone,11554,3951,realDonaldTrump
2510,735942401165033477,2016-05-26 21:15:16,"I find it offensive that Goofy Elizabeth Warren, sometimes referred to as Pocahontas, pretended to be Native American to get in Harvard.",Twitter for iPhone,28764,10369,realDonaldTrump
2511,735908158330130432,2016-05-26 18:59:12,Thank you Mr. &amp; Mrs. @TomBarrackJr for the wonderful and magical evening last night. It will not be forgotten. #Trump2016,Twitter for iPhone,8759,2135,realDonaldTrump
2512,735871869581205504,2016-05-26 16:35:00,.@kimguilfoyle- just watched you on @OutnumberedFNC- thank you!,Twitter for iPhone,9151,2194,realDonaldTrump
2513,735822406514675712,2016-05-26 13:18:27,The Inspector General's report on Crooked Hillary Clinton is a disaster. Such bad judgement and temperament cannot be allowed in the W.H.,Twitter for Android,21956,7717,realDonaldTrump
2514,735611127531347969,2016-05-25 23:18:54,"Thank you Anaheim, California!
#Trump2016 https://t.co/AEShamhNVS",Twitter for iPhone,18962,5509,realDonaldTrump
2515,735541674793783297,2016-05-25 18:42:55,"Thank you Washington! Honored to say, on behalf of our great movement, we have broken the all time record for votes in GOP primary history.",Twitter for iPhone,25347,7915,realDonaldTrump
2516,735465352436408320,2016-05-25 13:39:38,"The protesters in New Mexico were thugs who were flying the Mexican flag. The rally inside was big and beautiful, but outside, criminals!",Twitter for Android,34261,12476,realDonaldTrump
2517,735459144287719425,2016-05-25 13:14:58,Crooked Hillary Clinton just can't close the deal with Bernie. I had to knock out 16 very good and smart candidates. Hillary doesn't have it,Twitter for Android,23811,7632,realDonaldTrump
2518,735448311914602496,2016-05-25 12:31:56,"Goofy Senator Elizabeth Warren @elizabethforma has done less in the U.S. Senate than practically any other senator. All talk, no action!",Twitter for Android,15533,4822,realDonaldTrump
2519,735444721716199424,2016-05-25 12:17:40,"@elizabethforma  Goofy Elizabeth Warren, sometimes known as Pocahontas, bought foreclosed housing and made a quick killing. Total hypocrite!",Twitter for Android,7645,3973,realDonaldTrump
2520,735346597303816192,2016-05-25 05:47:45,"""@gordonsr1052:  Washington, BIG Thank You for supporting Trump! We are all going to help Trump Make America Great Again! Trump2016!""",Twitter for Android,10571,2778,realDonaldTrump
2521,735345985455554560,2016-05-25 05:45:19,"""@buiIdthewall: @realDonaldTrump high energy!""",Twitter for Android,7898,1952,realDonaldTrump
2522,735345952756801536,2016-05-25 05:45:11,"""@PiperSul: Great speech tonight Mr.Trump! Good Luck in California! Thank you.",Twitter for Android,7724,1797,realDonaldTrump
2523,735345398437556225,2016-05-25 05:42:59,"""@DeepakS76435750: @realDonaldTrump congratulations from India""",Twitter for Android,6687,1661,realDonaldTrump
2524,735345354992975873,2016-05-25 05:42:49,"""@oasisupernova: @realDonaldTrump UP TO 8.4 MILLION FOLLOWERS. CAN'T STOP THE #TrumpTrain 🚂 #MakeAmericaGreatAgain""",Twitter for Android,9400,2643,realDonaldTrump
2525,735345057587417089,2016-05-25 05:41:38,"""@jknatter: @realDonaldTrump #TrumpTrain""",Twitter for Android,5002,1144,realDonaldTrump
2526,735345023563247617,2016-05-25 05:41:30,"""@tcloer11: @realDonaldTrump Great job! Make America Great Again!""",Twitter for Android,6003,1406,realDonaldTrump
2527,735344013499326465,2016-05-25 05:37:29,"@elizabethforma Goofy Elizabeth Warren, sometimes referred to as Pocahontas because she faked the fact she is native American, is a lowlife!",Twitter for Android,4804,2095,realDonaldTrump
2528,735337786757238785,2016-05-25 05:12:44,"Great rally in New Mexico, amazing crowd! Now in L.A. Big rally in Anaheim.",Twitter for Android,11403,3112,realDonaldTrump
2529,735311006826700800,2016-05-25 03:26:20,"Thank you Washington! #Trump2016
#MakeAmericaGreatAgain https://t.co/v9glTwj6gy",Twitter for iPhone,14583,4708,realDonaldTrump
2530,735267499269226496,2016-05-25 00:33:27,Great honor to receive today's endorsement of @RickSantorum. Really nice! #Trump2016,Twitter for iPhone,15586,4693,realDonaldTrump
2531,735267332927279107,2016-05-25 00:32:47,"After raising, w/ no obligation, almost $6M for Vets, I couldn't believe protesters formed @ Trump Tower. JUST OUT- SENT BY CROOKED HILLARY!",Twitter for iPhone,15140,4938,realDonaldTrump
2532,735213812484345857,2016-05-24 21:00:07,"Thank you @DailyMail- for setting the failing @NYTimes story straight. This is what the NYT's should have written! 
https://t.co/Feb6dhctQo",Twitter for iPhone,12061,5337,realDonaldTrump
2533,735125552064024577,2016-05-24 15:09:24,A suggestion for the dishonest media- https://t.co/zKyRwEaLmz,Twitter Web Client,9292,3690,realDonaldTrump
2534,735124106476195841,2016-05-24 15:03:39,A wonderfully written article concerning Israel by @JasonDovEsq https://t.co/LZ9qWRYzdj,Twitter Web Client,8481,3463,realDonaldTrump
2535,735117032060899328,2016-05-24 14:35:32,A great new book has been written about Crooked Hillary. Read it &amp; you will never be able to vote for her. @Ed_Klein https://t.co/ujDwSSFhbx,Twitter Web Client,12631,6384,realDonaldTrump
2536,735073508124983298,2016-05-24 11:42:35,"Crooked Hillary Clinton overregulates, overtaxes and doesn't care about jobs. Most importantly, she suffers from plain old bad judgement!",Twitter for Android,19627,6828,realDonaldTrump
2537,735058192862969856,2016-05-24 10:41:44,"I just released my financial disclosure forms, the largest numbers in the history of the F.E.C. Even the dishonest media thinks great!",Twitter for Android,16723,5194,realDonaldTrump
2538,734939680278519809,2016-05-24 02:50:48,"Amazingly, with all of the money I have raised for the vets, I have got nothing but bad publicity from the dishonest and disgusting media.",Twitter for Android,24047,7790,realDonaldTrump
2539,734938503541325825,2016-05-24 02:46:08,"Much of the money I have raised for our veterans has already been distributed, with the rest to go shortly to various other veteran groups.",Twitter for Android,17076,4989,realDonaldTrump
2540,734936659851128832,2016-05-24 02:38:48,"While under no obligation to do so, I have raised between 5 &amp; 6 million dollars, including 1million dollars from me, for our VETERANS. Nice!",Twitter for Android,24525,6940,realDonaldTrump
2541,734903156589645824,2016-05-24 00:25:41,"Join me in California or Montana!
5/25/16: Anaheim, California
https://t.co/mmPck1HYrC
5/26/16: Billings, Montana
https://t.co/atvrCgjFDe",Twitter for iPhone,8061,3028,realDonaldTrump
2542,734892328637325312,2016-05-23 23:42:39,I will be interviewed on @oreillyfactor at 8:00 P.M. Enjoy!,Twitter for Android,8784,2067,realDonaldTrump
2543,734794856564936705,2016-05-23 17:15:20,"Obama’s VA Secretary just said we shouldn't measure
wait times. Hillary says VA problems are not ‘widespread.’ I will take care of
our vets!",Twitter Web Client,21503,7379,realDonaldTrump
2544,734768900282454016,2016-05-23 15:32:11,Is Hillary really protecting women? https://t.co/8ZtEIWNqz4,Twitter Web Client,10494,4330,realDonaldTrump
2545,734742416494845952,2016-05-23 13:46:57,"In trade, military and EVERYTHING else, it will be AMERICA FIRST! This will quickly lead to our ultimate goal: MAKE AMERICA GREAT AGAIN!",Twitter for Android,21781,8100,realDonaldTrump
2546,734517899960934400,2016-05-22 22:54:48,Thank you America! #Trump2016 https://t.co/xfINxdRNiQ,Twitter for iPhone,30720,11776,realDonaldTrump
2547,734485185148944384,2016-05-22 20:44:48,The American people are sick and tired of not being able to lead normal lives and to constantly be on the lookout for terror and terrorists!,Twitter for Android,25270,8845,realDonaldTrump
2548,734482099793711104,2016-05-22 20:32:33,Bernie Sanders is continuing his quest because he believes that Crooked Hillary Clinton will be forced out of the race - e-mail scandal!,Twitter for Android,20805,6012,realDonaldTrump
2549,734470625767620609,2016-05-22 19:46:57,"Join me on Wednesday, May 25th at the Anaheim Convention Center!
#Trump2016 #MAGA 
Tickets: https://t.co/mmPck1HYrC https://t.co/xGkVbxTamz",Twitter for iPhone,9359,3595,realDonaldTrump
2550,734468447829004288,2016-05-22 19:38:18,Crooked Hillary wants a radical 500% increase in Syrian refugees. We can’t allow this. Time to get smart and protect America!,Twitter for iPhone,23728,9617,realDonaldTrump
2551,734468142303305728,2016-05-22 19:37:05,"How can Crooked Hillary say she cares about women when she is silent on radical Islam, which horribly oppresses women?",Twitter for iPhone,28463,12761,realDonaldTrump
2552,734405641893249024,2016-05-22 15:28:44,RT @gatewaypundit: BREAKING POLL: Trump Gains 11 Points on Clinton Since March=&gt; Now Leads Crooked Hillary 46-44 https://t.co/y3BGy15Erb vi…,Twitter for iPhone,0,4305,realDonaldTrump
2553,734395329588670465,2016-05-22 14:47:45,Why do the networks continue to put dopey @BillKristol on panels when he has called every single shot about me wrong for 2 yrs?,Twitter for iPhone,14864,5015,realDonaldTrump
2554,734365143635759104,2016-05-22 12:47:48,Hillary Clinton is not qualified to be president because her judgement has been proven to be so bad! Would be four more years of stupidity!,Twitter for Android,31180,10750,realDonaldTrump
2555,734231223002894337,2016-05-22 03:55:39,Crooked Hillary said that I  want guns brought into the school classroom. Wrong!,Twitter for Android,18655,5913,realDonaldTrump
2556,734228313695236100,2016-05-22 03:44:05,"""@dubilujane: I trust @realDonaldTrump more anyone ever to protect America.He WILL do the right thing for the U.S.A, without a  doubt.",Twitter for Android,10538,2975,realDonaldTrump
2557,734114828529307648,2016-05-21 20:13:08,Thank you to all of the men and women who have served our country. You are our true heroes! #ArmedForcesDay https://t.co/A3Wus0cRIO,Twitter for iPhone,28368,10020,realDonaldTrump
2558,734066896794963968,2016-05-21 17:02:41,"Crooked Hillary Clintons foreign interventions unleashed ISIS in Syria, Iraq and Libya. She is reckless and dangerous!",Twitter for iPhone,17364,7327,realDonaldTrump
2559,734066397425307648,2016-05-21 17:00:42,MAKE AMERICA GREAT AGAIN! https://t.co/MAZK5bdZuD,Twitter for iPhone,27325,10068,realDonaldTrump
2560,734053246734499840,2016-05-21 16:08:26,".@CNN is so negative, getting even worse as I get closer. Just had two anti-Trump losers with zero rebuttal from my team. Turning off!",Twitter for Android,15054,4538,realDonaldTrump
2561,734014390731673600,2016-05-21 13:34:02,"""@RBacliff: Hillary wants to rip the guns out of America's hands. No guns = no protection. Get on #TrumpTrain &amp; join @NRA to stop her.""",Twitter for Android,13905,5001,realDonaldTrump
2562,734003305819570176,2016-05-21 12:49:59,Crooked Hillary wants to get rid of all guns and yet she is surrounded by bodyguards who are fully armed. No more guns to protect Hillary!,Twitter for Android,40063,15717,realDonaldTrump
2563,733974704445358080,2016-05-21 10:56:20,"While our wonderful president was out playing golf all day, the TSA is falling apart, just like our government! Airports a total disaster!",Twitter for Android,23564,8714,realDonaldTrump
2564,733838909805887488,2016-05-21 01:56:44,Crooked Hillary is spending tremendous amounts of Wall Street money on false ads against me. She is a very dishonest person!,Twitter for Android,20986,6935,realDonaldTrump
2565,733837704312410112,2016-05-21 01:51:57,Crooked Hillary Clinton wants to essentially abolish the 2nd Amendment. No gun owner can ever vote for Clinton!,Twitter for Android,20781,8213,realDonaldTrump
