,id,created_time,text,source,favorite_count,retweet_count,username
0,836933725602656256,2017-03-01 13:38:44,THANK YOU!,Twitter for Android,133931,21289,realDonaldTrump
1,836753422271582208,2017-03-01 01:42:16,"#JointSession #MAGA🇺🇸
https://t.co/RDO6Jt2pip",Twitter for iPhone,48608,8527,realDonaldTrump
2,836750538943377408,2017-03-01 01:30:49,"Join me live at 9:00 P.M. 
#JointAddress https://t.co/J882zbyVkJ https://t.co/gTtK3vJmkU",Twitter for iPhone,44261,6417,realDonaldTrump
3,836406328369242113,2017-02-28 02:43:03,I will be interviewed on @foxandfriends at 6:00 A.M. Enjoy!,Twitter for Android,75586,10582,realDonaldTrump
4,836332166728527872,2017-02-27 21:48:21,"GOP now viewed more favorably than Dems, in Trump era (per NBC/WSJ poll) via @HotlineJosh:
https://t.co/Soebxtg2Zd",Twitter for iPhone,64138,13731,realDonaldTrump
5,836261209540288513,2017-02-27 17:06:23,Great meeting with CEOs of leading U.S. health insurance companies who provide great healthcare to the American peo… https://t.co/60jigi6ffS,Twitter for iPhone,82604,14483,realDonaldTrump
6,835946001873657858,2017-02-26 20:13:52,"Big dinner with Governors tonight at White House. Much to be discussed, including healthcare.",Twitter for Android,102144,15499,realDonaldTrump
7,835916511944523777,2017-02-26 18:16:41,"Russia talk is FAKE NEWS put out by the Dems, and played up by the media, in order to mask the big election defeat and the illegal leaks!",Twitter for Android,108025,23699,realDonaldTrump
8,835817351178301440,2017-02-26 11:42:39,For first time the failing @nytimes will take an ad (a bad one) to help save its failing reputation. Try reporting accurately &amp; fairly!,Twitter for Android,105661,21466,realDonaldTrump
9,835814988686233601,2017-02-26 11:33:16,"The race for DNC Chairman was, of course, totally ""rigged."" Bernie's guy, like Bernie himself, never had a chance. Clinton demanded Perez!",Twitter for Android,84301,18829,realDonaldTrump
10,835610917568200705,2017-02-25 22:02:22,"Congratulations to Thomas Perez, who has just been named Chairman of the DNC. I could not be happier for him, or for the Republican Party!",Twitter for Android,128495,28940,realDonaldTrump
11,835608648625836032,2017-02-25 21:53:21,I will not be attending the White House Correspondents' Association Dinner this year. Please wish everyone well and have a great evening!,Twitter for Android,121831,23991,realDonaldTrump
12,835553050530099200,2017-02-25 18:12:25,Weekly Address from @WhiteHouse: https://t.co/uaoQSHBOQB https://t.co/7eF6aC6kEC,Twitter for iPhone,43826,9935,realDonaldTrump
13,835481237879926784,2017-02-25 13:27:04,"Great optimism for future of U.S. business, AND JOBS, with the DOW having an 11th straight record close. Big tax &amp; regulation cuts coming!",Twitter for Android,102039,19610,realDonaldTrump
14,835479283699224576,2017-02-25 13:19:18,The media has not reported that the National Debt in my first month went down by $12 billion vs a $200 billion increase in Obama first mo.,Twitter for Android,197800,60906,realDonaldTrump
15,835465719970217984,2017-02-25 12:25:24,Maybe the millions of people who voted to MAKE AMERICA GREAT AGAIN should have their own rally. It would be the biggest of them all!,Twitter for Android,156607,34465,realDonaldTrump
16,835325771858251776,2017-02-25 03:09:18,FAKE NEWS media knowingly doesn't tell the truth. A great danger to our country. The failing @nytimes has become a joke. Likewise @CNN. Sad!,Twitter for Android,107498,26147,realDonaldTrump
17,835173525522624512,2017-02-24 17:04:19,"Trump vows to fight 'epidemic' of human trafficking 
https://t.co/oDLZ2NdrtA",Twitter for iPhone,88822,19738,realDonaldTrump
18,835124485632180224,2017-02-24 13:49:27,Going to CPAC!,Twitter for Android,70990,8914,realDonaldTrump
19,835106143462703104,2017-02-24 12:36:34,find the leakers within the FBI itself. Classified information is being given to media that could have a devastating effect on U.S. FIND NOW,Twitter for Android,99559,21633,realDonaldTrump
20,835104946034991106,2017-02-24 12:31:49,"The FBI is totally unable to stop the national security ""leakers"" that have permeated our government for a long time. They can't even......",Twitter for Android,79195,17550,realDonaldTrump
21,834917440450609152,2017-02-24 00:06:44,Big interview tonight by Henry Kravis at The Business Council of Washington. Looking forward to it!,Twitter for Android,57385,8231,realDonaldTrump
22,834916167177371648,2017-02-24 00:01:40,Seven people shot and killed yesterday in Chicago. What is going on there - totally out of control. Chicago needs help!,Twitter for Android,108062,23351,realDonaldTrump
23,834899071982841856,2017-02-23 22:53:45,'S&amp;P 500 Edges Higher After Trump Renews Jobs Pledge' https://t.co/WtrRJVFmvU,Twitter for iPhone,55353,10519,realDonaldTrump
24,834384982495940613,2017-02-22 12:50:56,Very much enjoyed my tour of the Smithsonian's National Museum of African American History and Culture...A great job done by amazing people!,Twitter for Android,116848,16312,realDonaldTrump
25,834377364947816448,2017-02-22 12:20:40,"One thing I will say about Rep. Keith Ellison, in his fight to lead the DNC, is that he was the one who predicted early that I would win!",Twitter for Android,79175,12195,realDonaldTrump
26,834181712783560705,2017-02-21 23:23:13,"The so-called angry crowds in home districts of some Republicans are actually, in numerous cases, planned out by liberal activists. Sad!",Twitter for Android,118927,26321,realDonaldTrump
27,834142323881684993,2017-02-21 20:46:42,'Americans overwhelmingly oppose sanctuary cities' https://t.co/s5QvsJWA6u,Twitter for iPhone,107324,23814,realDonaldTrump
28,833838311315763200,2017-02-21 00:38:40,"Congratulations to our new National Security Advisor, General H.R. McMaster. Video: https://t.co/BKn9r225Kk https://t.co/VBXcJ1b6Pv",Twitter for iPhone,94287,16085,realDonaldTrump
29,833783438922629125,2017-02-20 21:00:37,Just named General H.R. McMaster National Security Advisor.,Twitter for Android,106997,15942,realDonaldTrump
30,833686030679207936,2017-02-20 14:33:33,HAPPY PRESIDENTS DAY - MAKE AMERICA GREAT AGAIN!,Twitter for Android,245072,49703,realDonaldTrump
31,833681539997253636,2017-02-20 14:15:42,Give the public a break - The FAKE NEWS media is trying to say that large scale immigration in Sweden is working out just beautifully. NOT!,Twitter for Android,142573,35428,realDonaldTrump
32,833435244451753984,2017-02-19 21:57:01,My statement as to what's happening in Sweden was in reference to a story that was broadcast on @FoxNews concerning immigrants &amp; Sweden.,Twitter for Android,113405,26600,realDonaldTrump
33,832950628750127106,2017-02-18 13:51:20,"Will be having many meetings this weekend at The Southern White House. Big 5:00 P.M. speech in Melbourne, Florida. A lot to talk about!",Twitter for Android,100236,15438,realDonaldTrump
34,832945737625387008,2017-02-18 13:31:53,Don't believe the main stream (fake news) media.The White House is running VERY WELL. I inherited a MESS and am in the process of fixing it.,Twitter for Android,188201,39486,realDonaldTrump
35,832742165436579840,2017-02-18 00:02:58,Looking forward to the Florida rally tomorrow. Big crowd expected!,Twitter for Android,100024,14327,realDonaldTrump
36,832730328108134402,2017-02-17 23:15:56,"""One of the most effective press conferences I've ever seen!"" says Rush Limbaugh. Many agree.Yet FAKE MEDIA  calls it differently! Dishonest",Twitter for Android,121571,21981,realDonaldTrump
37,832708293516632065,2017-02-17 21:48:22,"The FAKE NEWS media (failing @nytimes, @NBCNews, @ABC, @CBS, @CNN) is not my enemy, it is the enemy of the American People!",Twitter for Android,161852,50995,realDonaldTrump
38,832614137586933760,2017-02-17 15:34:14,"Join me at 11:00am:
Watch here: https://t.co/veqKmsGAwf https://t.co/UzndIjIqjM",Twitter for iPhone,56766,10004,realDonaldTrump
39,832579442790772736,2017-02-17 13:16:22,"General Keith Kellogg, who I have known for a long time, is very much in play for NSA - as are three others.",Twitter for iPhone,70206,11099,realDonaldTrump
40,832555987299082242,2017-02-17 11:43:10,Thank you for all of the nice statements on the Press Conference yesterday. Rush Limbaugh said one of greatest ever. Fake media not happy!,Twitter for Android,152620,26730,realDonaldTrump
41,832554772318322688,2017-02-17 11:38:20,"Going to Charleston, South Carolina, in order to spend time with Boeing and talk jobs! Look forward to it.",Twitter for Android,99985,14486,realDonaldTrump
42,832533430168608768,2017-02-17 10:13:32,"Despite the long delays by the Democrats in finally approving Dr. Tom Price, the repeal and replacement of ObamaCare is moving fast!",Twitter for Android,103853,17375,realDonaldTrump
43,832375230274400256,2017-02-16 23:44:54,'Trump signs bill undoing Obama coal mining rule' https://t.co/yMfT5r5RGh,Twitter for iPhone,94535,18907,realDonaldTrump
44,832238070460186625,2017-02-16 14:39:52,"The Democrats had to come up with a story as to why they lost the election, and so badly (306), so they made up a story - RUSSIA. Fake news!",Twitter for Android,122748,27206,realDonaldTrump
45,832230758299340800,2017-02-16 14:10:49,"FAKE NEWS media, which makes up stories and ""sources,"" is far more effective than the discredited Democrats - but they are fading fast!",Twitter for Android,100469,20111,realDonaldTrump
46,832198588201594880,2017-02-16 12:02:59,The spotlight has finally been put on the low-life leakers! They will be caught!,Twitter for Android,127843,25571,realDonaldTrump
47,832197515248275456,2017-02-16 11:58:43,"Leaking, and even illegal classified leaking, has been a big problem in Washington for years. Failing @nytimes (and others) must apologize!",Twitter for Android,90733,17306,realDonaldTrump
48,832191485701451777,2017-02-16 11:34:46,Stock market hits new high with longest winning streak in decades. Great level of confidence and optimism - even before tax plan rollout!,Twitter for Android,129280,23995,realDonaldTrump
49,832016501657968640,2017-02-15 23:59:26,"Venezuela should allow Leopoldo Lopez, a political prisoner &amp; husband of @liliantintori (just met w/ @marcorubio) o… https://t.co/HhgE51dtSN",Twitter for iPhone,109658,53106,realDonaldTrump
50,831979921555742732,2017-02-15 21:34:05,"Aetna CEO: Obamacare in 'Death Spiral' #RepealAndReplace 
https://t.co/dmHL7xIEQv",Twitter for iPhone,59168,14742,realDonaldTrump
51,831952535544070145,2017-02-15 19:45:16,"Join me in Florida this Saturday at 5pm for a rally at the Orlando-Melbourne International Airport!
Tickets:… https://t.co/OigfXFECPp",Twitter for iPhone,72803,18048,realDonaldTrump
52,831945670324060164,2017-02-15 19:17:59,"Welcome to the United States, @IsraeliPM Benjamin &amp; Sara!
#ICYMI🇺🇸🇮🇱Joint Press Conference: 
https://t.co/GN6ALWUusN https://t.co/bH60nBL5FP",Twitter for iPhone,75020,14353,realDonaldTrump
53,831904516316479489,2017-02-15 16:34:27,Great listening session with CEO's of the Retail Industry Leaders Association this morning! https://t.co/sy6xJcWfcF,Twitter for iPhone,66553,10781,realDonaldTrump
54,831853862281699331,2017-02-15 13:13:10,"The real scandal here is that classified information is illegally given out by ""intelligence"" like candy. Very un-American!",Twitter for Android,128164,28920,realDonaldTrump
55,831846101179314177,2017-02-15 12:42:20,Crimea was TAKEN by Russia during the Obama Administration. Was Obama too soft on Russia?,Twitter for Android,102060,25712,realDonaldTrump
56,831842652085686273,2017-02-15 12:28:37,"Thank you to Eli Lake of The Bloomberg View - ""The NSA &amp; FBI...should not interfere in our politics...and is"" Very serious situation for USA",Twitter for Android,78574,16534,realDonaldTrump
57,831840306161123328,2017-02-15 12:19:18,Information is being illegally given to the failing @nytimes &amp; @washingtonpost by the intelligence community (NSA and FBI?).Just like Russia,Twitter for Android,81285,21345,realDonaldTrump
58,831837514226921472,2017-02-15 12:08:12,This Russian connection non-sense is merely an attempt to cover-up the many mistakes made in Hillary Clinton's losing campaign.,Twitter for Android,119472,27821,realDonaldTrump
59,831830548565852160,2017-02-15 11:40:32,The fake news media is going crazy with their conspiracy theories and blind hatred. @MSNBC &amp; @CNN are unwatchable. @foxandfriends is great!,Twitter for Android,105820,26207,realDonaldTrump
60,831636777110757377,2017-02-14 22:50:33,"Obamacare continues to fail. Humana to pull out in 2018. Will repeal, replace &amp; save healthcare for ALL Americans. 
https://t.co/glWEQ0lNR4",Twitter for iPhone,88973,18119,realDonaldTrump
61,831621079747723264,2017-02-14 21:48:10,"'Remarks by President Trump at Signing of H.J. Resolution 41'
https://t.co/Q3MoCGAc54 https://t.co/yGDDTKm9Br",Twitter for iPhone,46355,8561,realDonaldTrump
62,831599387906301952,2017-02-14 20:21:59,Great parent-teacher listening session this morning with @VP Pence &amp; @usedgov Secretary @BetsyDeVos. Watch:… https://t.co/nuLTs513Ot,Twitter for iPhone,59399,11416,realDonaldTrump
63,831510532318429184,2017-02-14 14:28:54,The real story here is why are there so many illegal leaks coming out of Washington? Will these leaks be happening as I deal on N.Korea etc?,Twitter for Android,112967,26946,realDonaldTrump
64,831344902990655489,2017-02-14 03:30:45,Congratulations to our new #VASecretary Dr. David Shulkin. Time to take care of Veterans who have fought to protect… https://t.co/FNewjbHuw4,Twitter for iPhone,91896,16428,realDonaldTrump
65,831336432073658368,2017-02-14 02:57:05,Congratulations Treasury Secretary Steven Mnuchin! #ICYMI- watch here: https://t.co/RPsmw4yD7y https://t.co/K8tWLlXiYK,Twitter for iPhone,64557,11044,realDonaldTrump
66,831214091993751552,2017-02-13 18:50:57,Wonderful meeting with Canadian PM @JustinTrudeau and a group of leading CEO's &amp; business women from Canada🇨🇦and th… https://t.co/wAoCOaYeZ6,Twitter for iPhone,86351,15651,realDonaldTrump
67,831185943482793986,2017-02-13 16:59:06,Welcome to the @WhiteHouse Prime Minister @JustinTrudeau! https://t.co/WKgF8Zo9ri,Twitter for iPhone,85702,13673,realDonaldTrump
68,831169341358014475,2017-02-13 15:53:08,Today I will meet with Canadian PM Trudeau and a group of leading business women to discuss women in the workforce. https://t.co/bFAHPRXHdP,Twitter for iPhone,75013,11907,realDonaldTrump
69,830904083519242241,2017-02-12 22:19:05,Just leaving Florida. Big crowds of enthusiastic supporters lining the road that the FAKE NEWS media refuses to mention. Very dishonest!,Twitter for Android,143642,25895,realDonaldTrump
70,830804130692268032,2017-02-12 15:41:55,Congratulations Stephen Miller- on representing me this morning on the various Sunday morning shows. Great job!,Twitter for iPhone,104468,16222,realDonaldTrump
71,830769247185952772,2017-02-12 13:23:18,I know Mark Cuban well. He backed me big-time but I wasn't interested in taking all of his calls.He's not smart enough to run for president!,Twitter for Android,83574,15541,realDonaldTrump
72,830764596235485188,2017-02-12 13:04:49,"After two days of very productive talks, Prime Minister Abe is heading back to Japan. L",Twitter for Android,84041,13408,realDonaldTrump
73,830751875578355713,2017-02-12 12:14:16,"While on FAKE NEWS @CNN, Bernie Sanders was cut off for using the term fake news to describe the network. They said technical difficulties!",Twitter for Android,114953,25478,realDonaldTrump
74,830747067379232769,2017-02-12 11:55:10,"72% of refugees admitted into U.S. (2/3 -2/11) during COURT BREAKDOWN are from 7 countries: SYRIA, IRAQ, SOMALIA, IRAN, SUDAN, LIBYA &amp; YEMEN",Twitter for Android,81780,22875,realDonaldTrump
75,830741932099960834,2017-02-12 11:34:45,"The crackdown on illegal criminals is merely the keeping of my campaign promise. Gang members, drug dealers &amp; others are being removed!",Twitter for Android,150851,29920,realDonaldTrump
76,830643095150657536,2017-02-12 05:02:01,#ICYMI: Joint Statement with Prime Minister Shinzo Abe on North Korea. https://t.co/qEC87FKB1D,Twitter for iPhone,63121,14975,realDonaldTrump
77,830618234726543360,2017-02-12 03:23:13,RT @Scavino45: LIVE Joint Statement by President Trump and Prime Minister Shinzo Abe: https://t.co/c3Fe5cUaaS,Twitter for iPhone,0,4848,realDonaldTrump
78,830558065715998726,2017-02-11 23:24:08,"A working dinner tonight with Prime Minister Abe of Japan, and his representatives, at the Winter White House (Mar-a-Lago). Very good talks!",Twitter for Android,99014,14114,realDonaldTrump
79,830555911559249926,2017-02-11 23:15:34,"Played golf today with Prime Minister Abe of Japan and @TheBig_Easy, Ernie Els, and had a great time. Japan is very well represented!",Twitter for iPhone,85390,13549,realDonaldTrump
80,830552079240409089,2017-02-11 23:00:21,"I am so proud of my daughter Ivanka. To be abused and treated so badly by the media, and to still hold her head so high, is truly wonderful!",Twitter for Android,210345,28883,realDonaldTrump
81,830483672096768001,2017-02-11 18:28:31,"Having a great time hosting Prime Minister Shinzo Abe in the United States! 
https://t.co/Fvjsac89qS… https://t.co/hKqbMB2aQ9",Twitter for iPhone,93724,17297,realDonaldTrump
82,830409522397184000,2017-02-11 13:33:53,"Melania and I are hosting Japanese Prime Minister Shinzo Abe and Mrs. Abe at Mar-a-Lago in Palm Beach, Fla. They are a wonderful couple!",Twitter for Android,122023,17254,realDonaldTrump
83,830407172747988992,2017-02-11 13:24:32,"...design or negotiations yet. When I do, just like with the F-35 FighterJet or the Air Force One Program, price will come WAY DOWN!",Twitter for Android,85025,13133,realDonaldTrump
84,830405706255912960,2017-02-11 13:18:43,"I am reading that the great border WALL will cost more than the government originally thought, but I have not gotten involved in the.....",Twitter for Android,78211,14245,realDonaldTrump
85,830389130311921667,2017-02-11 12:12:51,"Our legal system is broken! ""77% of refugees allowed into U.S. since travel reprieve hail from seven suspect countries."" (WT)  SO DANGEROUS!",Twitter for Android,102644,23322,realDonaldTrump
86,830195857530183684,2017-02-10 23:24:51,Heading to Joint Base Andrews on #MarineOne with Prime Minister Shinzō earlier today. https://t.co/4JFhyYdeHO,Twitter for iPhone,163548,42215,realDonaldTrump
87,830047626414477312,2017-02-10 13:35:50,"The failing @nytimes does major FAKE NEWS China story saying ""Mr.Xi has not spoken to Mr. Trump since Nov.14."" We spoke at length yesterday!",Twitter for Android,108794,24146,realDonaldTrump
88,830042498806460417,2017-02-10 13:15:27,"LAWFARE: ""Remarkably, in the entire opinion, the panel did not bother even to cite this (the) statute."" A disgraceful decision!",Twitter for Android,90656,17797,realDonaldTrump
89,829836231802515457,2017-02-09 23:35:49,"SEE YOU IN COURT, THE SECURITY OF OUR NATION IS AT STAKE!",Twitter for Android,240618,67685,realDonaldTrump
90,829721019720015872,2017-02-09 15:58:01,"Join us live in the Oval Office for the swearing in of our new Attorney General, @SenatorSessions!
LIVE:… https://t.co/QeW6vjog4A",Twitter for iPhone,72163,10914,realDonaldTrump
91,829689436279603206,2017-02-09 13:52:31,"..Ryan died on a winning mission ( according to General Mattis), not a ""failure."" Time for the U.S. to get smart and start winning again!",Twitter for Android,92495,15117,realDonaldTrump
92,829684271812067328,2017-02-09 13:31:59,"...long he doesn't know how to win anymore, just look at the mess our country is in - bogged down in conflict all over the place. Our hero..",Twitter for Android,69054,11977,realDonaldTrump
93,829682794951475200,2017-02-09 13:26:07,Sen. McCain should not be talking about the success or failure of a mission to the media. Only emboldens the enemy! He's been losing so....,Twitter for Android,87087,16019,realDonaldTrump
94,829681034564341760,2017-02-09 13:19:08,"Chris Cuomo, in his interview with Sen. Blumenthal, never asked him about his long-term lie about his brave ""service"" in Vietnam. FAKE NEWS!",Twitter for Android,74900,15121,realDonaldTrump
95,829660612452036608,2017-02-09 11:57:59,"Sen.Richard Blumenthal, who never fought in Vietnam when he said for years he had (major lie),now misrepresents what Judge Gorsuch told him?",Twitter for Android,86144,19672,realDonaldTrump
96,829496507841789952,2017-02-09 01:05:53,"Congratulations to our new Attorney General, @SenatorSessions! https://t.co/e0buP1K83z",Twitter for iPhone,165823,33150,realDonaldTrump
97,829451566000242688,2017-02-08 22:07:18,"'Trump administration seen as more truthful than news media'
https://t.co/6LmsR5JOSW",Twitter for iPhone,89403,17925,realDonaldTrump
98,829446266111287305,2017-02-08 21:46:14,"'Majority in Leading EU Nations Support Trump-Style Travel Ban' 
Poll of more than 10,000 people in 10 countries...https://t.co/KWsIWhtC9o",Twitter for iPhone,84312,22142,realDonaldTrump
99,829414457126313986,2017-02-08 19:39:51,'Immigration Ban Is One Of Trump's Most Popular Orders So Far' https://t.co/wAelwuQ4BE,Twitter for iPhone,124573,30830,realDonaldTrump
100,829410107406614534,2017-02-08 19:22:33,"Thank you Brian Krzanich, CEO of @Intel. A great investment ($7 BILLION) in American INNOVATION and JOBS!… https://t.co/oicfDsPKHQ",Twitter for iPhone,99126,22354,realDonaldTrump
101,829384587482656768,2017-02-08 17:41:09,"Big increase in traffic into our country from certain areas, while our people are far more vulnerable, as we wait for what should be EASY D!",Twitter for Android,89918,17820,realDonaldTrump
102,829357626798530561,2017-02-08 15:54:01,'16 Fake News Stories Reporters Have Run Since Trump Won' https://t.co/0dHld5kiVc,Twitter for iPhone,65193,19422,realDonaldTrump
103,829356871848951809,2017-02-08 15:51:01,My daughter Ivanka has been treated so unfairly by @Nordstrom. She is a great person -- always pushing me to do the right thing! Terrible!,Twitter for iPhone,144524,27689,realDonaldTrump
104,829349943613734912,2017-02-08 15:23:29,Thank you to our great Police Chiefs &amp; Sheriffs for your leadership &amp; service. You have a true friend in the… https://t.co/Lysnv8ZR1h,Twitter for iPhone,91218,16360,realDonaldTrump
105,829315036329963521,2017-02-08 13:04:47,"I will be speaking at 9:00 A.M. today to Police Chiefs and Sheriffs and will be discussing the horrible, dangerous and wrong decision.......",Twitter for Android,76065,11007,realDonaldTrump
106,829299566344359936,2017-02-08 12:03:18,"If the U.S. does not win this case as it so obviously should, we can never have the security and safety to which we are entitled. Politics!",Twitter for Android,116743,22611,realDonaldTrump
107,829133645055135750,2017-02-08 01:04:00,"It is a disgrace that my full Cabinet is still not in place, the longest such delay in the history of our country. Obstruction by Democrats!",Twitter for Android,159924,37011,realDonaldTrump
108,829003091735359488,2017-02-07 16:25:13,An honor having the National Sheriffs' Assoc. join me at the @WhiteHouse. Incredible men &amp; women who protect &amp; serv… https://t.co/1LkhbCNh8L,Twitter for iPhone,109743,18655,realDonaldTrump
109,828939235499638784,2017-02-07 12:11:29,"I don't know Putin, have no deals in Russia, and the haters are going crazy - yet Obama can make a deal with Iran, #1 in terror, no problem!",Twitter for iPhone,191428,51385,realDonaldTrump
110,828797801630937089,2017-02-07 02:49:28,"The threat from radical Islamic terrorism is very real, just look at what is happening in Europe and the Middle-East. Courts must act fast!",Twitter for Android,148332,33229,realDonaldTrump
111,828793887275761665,2017-02-07 02:33:55,The failing @nytimes was forced to apologize to its subscribers for the poor reporting it did on my election win. Now they are worse!,Twitter for Android,93506,16750,realDonaldTrump
112,828748574255091714,2017-02-06 23:33:52,An extended interview from the Super Bowl with @oreillyfactor airs tonight at 8:00 P.M. Enjoy! https://t.co/kZdHqaNTVR,Twitter for iPhone,54286,8193,realDonaldTrump
113,828642511698669569,2017-02-06 16:32:24,"The failing @nytimes writes total fiction concerning me. They have gotten it wrong for two years, and now are making up stories &amp; sources!",Twitter for Android,98379,19643,realDonaldTrump
114,828575949268606977,2017-02-06 12:07:55,"I call my own shots, largely based on an accumulation of data, and everyone knows it. Some FAKE NEWS media, in order to marginalize, lies!",Twitter for Android,127634,24448,realDonaldTrump
115,828574430800539648,2017-02-06 12:01:53,"Any negative polls are fake news, just like the CNN, ABC, NBC polls in the election. Sorry, people want border security and extreme vetting.",Twitter for Android,164660,36964,realDonaldTrump
116,828447350200926212,2017-02-06 03:36:54,"What an amazing comeback and win by the Patriots. Tom Brady, Bob Kraft and Coach B are total winners. Wow!",Twitter for Android,271874,74687,realDonaldTrump
117,828375073006444544,2017-02-05 22:49:42,Enjoy the #SuperBowl and then we continue: MAKE AMERICA GREAT AGAIN!,Twitter for Android,188128,37378,realDonaldTrump
118,828343072840900610,2017-02-05 20:42:33,I have instructed Homeland Security to check people coming into our country VERY CAREFULLY. The courts are making the job very difficult!,Twitter for Android,149565,29028,realDonaldTrump
119,828342202174668800,2017-02-05 20:39:05,Just cannot  believe a judge would put our country in such peril. If something happens blame him and court system. People pouring in. Bad!,Twitter for Android,140633,29647,realDonaldTrump
120,828042506851934209,2017-02-05 00:48:12,The judge opens up our country to potential terrorists and others that do not have our best interests at heart. Bad people are very happy!,Twitter for Android,131946,28681,realDonaldTrump
