,created_time,text,source,favorite_count,retweet_count,hashtags,user_mentioned,url_used,media_used
0,2017-03-23 01:33:54,Spoke to U.K. Prime Minister Theresa May today to offer condolences on the terrorist attack in London. She is strong and doing very well.,Twitter for iPhone,49837,9060,[],[],False,False
1,2017-03-23 01:04:32,RT @mitchellvii: Trump always ends up being right.  It's almost a little freaky.,Twitter for iPhone,0,9698,[],[u'Bill Mitchell'],False,False
2,2017-03-23 01:03:18,RT @mitchellvii: EXACTLY AS I SAID - House Intel Chair: We Cannot Rule Out Sr. Obama Officials Were Involved in Trump Surveillance https://…,Twitter for iPhone,0,7231,[],[u'Bill Mitchell'],False,False
3,2017-03-22 13:09:35,Big day for healthcare. Working hard!,Twitter for iPhone,74904,11107,[],[],False,False
4,2017-03-21 18:12:05,"Today on #NationalAgDay, we honor our great American farmers &amp; ranchers. Their hard work &amp; dedication are ingrained… https://t.co/IpGRhly2zj",Twitter for iPhone,59611,13619,[u'NationalAgDay'],[],True,False
5,2017-03-21 17:33:23,"Honored to sign S.442 today. With this legislation, we support @NASA's scientists, engineers, and astronauts in the… https://t.co/Z5VwluvJQx",Twitter for iPhone,59404,13810,[],[u'NASA'],True,False
6,2017-03-21 17:02:31,Joined the @HouseGOP Conference this morning at the U.S. Capitol. https://t.co/03e4YBIWr0 #PassTheBill #MAGA🇺🇸… https://t.co/3swdFWGQtP,Twitter for iPhone,31376,5544,"[u'PassTheBill', u'MAGA']",[u'House Republicans'],True,False
7,2017-03-21 02:18:20,"Thank you Louisville, Kentucky. Together, we will MAKE AMERICA SAFE AND GREAT AGAIN! https://t.co/qGgWEWUvek",Twitter for iPhone,71366,14111,[],[],False,True
8,2017-03-20 23:03:36,"Thank you Louisville, Kentucky- on my way! #MAGA🇺🇸 https://t.co/3QsBsib6kt",Twitter for iPhone,57829,10783,[u'MAGA'],[],False,True
9,2017-03-20 17:15:18,Congratulations Eric &amp; Lara. Very proud and happy for the two of you! https://t.co/s0T3cTQc40,Twitter for iPhone,96661,13213,[],[],True,False
10,2017-03-20 13:14:49,"What about all of the contact with the Clinton campaign and the Russians? Also, is it true that the DNC would not let the FBI in to look?",Twitter for iPhone,78832,21117,[],[],False,False
11,2017-03-20 12:35:14,Just heard Fake News CNN is doing polls again despite the fact that their election polls were a WAY OFF disaster. Much higher ratings at Fox,Twitter for iPhone,87044,18173,[],[],False,False
12,2017-03-20 11:02:57,"The real story that Congress, the FBI and all others should be looking into is the leaking of Classified information. Must find leaker now!",Twitter for iPhone,60865,14573,[],[],False,False
13,2017-03-20 10:49:48,The Democrats made up and pushed the Russian story as an excuse for running a terrible campaign. Big advantage in Electoral College &amp; lost!,Twitter for iPhone,85438,20046,[],[],False,False
14,2017-03-20 10:35:28,James Clapper and others stated that there is no evidence Potus colluded with Russia. This story is FAKE NEWS and everyone knows it!,Twitter for iPhone,68665,16875,[],[],False,False
15,2017-03-19 20:20:22,"#ICYMI: Weekly Address 
➡️https://t.co/ckVx2zgA1x https://t.co/dTGZLvlsGv",Twitter for iPhone,35035,7313,[u'ICYMI'],[],True,True
16,2017-03-18 13:23:37,"...vast sums of money to NATO &amp; the United States must be paid more for the powerful, and very expensive, defense it provides to Germany!",Twitter for iPhone,85863,19494,[],[],False,False
17,2017-03-18 13:15:41,"Despite what you have heard from the FAKE NEWS, I had a GREAT meeting with German Chancellor Angela Merkel. Nevertheless, Germany owes.....",Twitter for iPhone,94432,21127,[],[],False,False
18,2017-03-17 15:39:10,Great meeting with the @RepublicanStudy Committee this morning at the @WhiteHouse! https://t.co/8Y2UoHoYaY,Twitter for iPhone,45766,8200,[],"[u'RSC', u'The White House']",False,True
19,2017-03-17 14:07:26,"""The President Changed. So Has Small Businesses' Confidence""
https://t.co/daTGjPmYeJ",Twitter for iPhone,50733,11409,[],[],True,False
20,2017-03-17 13:07:15,"North Korea is behaving very badly. They have been ""playing"" the United States for years. China has done little to help!",Twitter for iPhone,88374,20840,[],[],False,False
21,2017-03-17 12:34:17,"RT @foxandfriends: FOX NEWS ALERT: Jihadis using religious visa to enter US, experts warn (via @FoxFriendsFirst) https://t.co/pwXeR9OMQC",Twitter for iPhone,0,11238,[],"[u'FOX & friends', u'Fox & Friends First']",False,True
22,2017-03-17 12:30:25,RT @foxandfriends: VIDEO: Rep. Scalise — GOP agrees on over 85 percent of health care bill https://t.co/05dtfjAUbx,Twitter for iPhone,0,3356,[],[u'FOX & friends'],True,False
23,2017-03-17 12:26:12,"RT @AmericaFirstPol: MAJOR IMPACT: @POTUS Trump is 50 Days in and moving swiftly to get America back on the right track. #MAGA 
https://t.c…",Twitter for iPhone,0,5908,[u'MAGA'],"[u'AmericaFirstPolicies', u'President Trump']",False,False
24,2017-03-17 12:20:22,RT @FoxNews: Jobs created in February. https://t.co/sOaMDxxTA8,Twitter for iPhone,0,7513,[],[u'Fox News'],False,True
25,2017-03-17 12:12:04,Happy Lá Fheile Phadraig to all of my great Irish friends!,Twitter for iPhone,68044,12191,[],[],False,False
26,2017-03-17 09:35:58,"RT @DiamondandSilk: When the President says ""You're Fired""     That means: ""Pack Yo Stuff and Go, Not Say ""You Refuse to Go!  #DrainTheSwam…",Twitter for iPhone,0,10723,[],[u'Diamond and Silk\xae'],False,False
27,2017-03-16 22:43:32,My representatives had a great meeting w/ the Hispanic Chamber of Commerce at the WH today. Look forward to tremendous growth &amp; future mtgs!,Twitter for iPhone,64070,10557,[],[],False,False
28,2017-03-16 21:54:02,Great progress on healthcare. Improvements being made - Republicans coming together!,Twitter for iPhone,69831,11172,[],[],False,False
29,2017-03-16 21:43:07,RT @USHCC: USHCC was delighted to host @IvankaTrump for a roundtable discussion w/ Hispanic women biz owners today in Washington #USHCCLegi…,Twitter for iPhone,0,7265,[],"[u'USHCC', u'Ivanka Trump']",False,False
30,2017-03-16 20:09:38,"An honor to welcome the Taoiseach of Ireland, @EndaKennyTD to the @WhiteHouse today with @VP Pence. 🇺🇸🇮🇪 https://t.co/J3iTl2iSiQ",Twitter for iPhone,52505,10788,[],"[u'Enda Kenny', u'The White House', u'Vice President Pence']",False,True
31,2017-03-16 15:52:22,A budget that puts #AmericaFirst must make safety its no. 1 priority—without safety there can be no prosperity: https://t.co/9lxx1iQo7m,Twitter for iPhone,68449,14587,[u'AmericaFirst'],[],True,False
32,2017-03-16 04:20:41,"Thank you Nashville, Tennessee! https://t.co/6snvQ0DzXN",Twitter for iPhone,80197,15170,[],[],False,True
33,2017-03-16 00:03:23,"In Nashville, Tennessee! Lets MAKE AMERICA GREAT AGAIN! https://t.co/m5UR4vv6UH",Twitter for iPhone,86330,16694,[],[],False,True
34,2017-03-15 23:25:25,Thank you Andrew Jackson! #POTUS7 #USA🇺🇸 https://t.co/GToWsWXiNv,Twitter for iPhone,66718,13351,"[u'POTUS7', u'USA']",[],False,True
35,2017-03-15 20:55:52,I will be interviewed by @TuckerCarlson tonight at 9:00 P.M. on @FoxNews. Enjoy!,Twitter for iPhone,60012,9554,[],"[u'Tucker Carlson', u'Fox News']",False,False
36,2017-03-15 12:14:20,CEO's most optimistic since 2009. It will only get better as we continue to slash unnecessary regulations and when we begin our big tax cut!,Twitter for iPhone,80813,14416,[],[],False,False
37,2017-03-15 11:29:05,"Looking forward to a big rally in Nashville, Tennessee, tonight. Big crowd of great people expected. Will be fun!",Twitter for iPhone,85264,14464,[],[],False,False
38,2017-03-15 11:13:58,"Will be going to Detroit, Michigan (love), today for a big meeting on bringing back car production to State &amp; U.S. Already happening!",Twitter for iPhone,89703,15037,[],[],False,False
39,2017-03-15 11:02:40,"Can you imagine what the outcry would be if @SnoopDogg, failing career and all, had aimed and fired the gun at President Obama? Jail time!",Twitter for iPhone,127484,40991,[],[u'Snoop Dogg'],False,False
40,2017-03-15 10:55:30,"Does anybody really believe that a reporter, who nobody ever heard of, ""went to his mailbox"" and found my tax returns? @NBCNews  FAKE NEWS!",Twitter for iPhone,103325,26176,[],[u'NBC News'],False,False
41,2017-03-14 16:12:22,Great optimism in America – and the results will be even better! https://t.co/SYBl47CsZn,Twitter for iPhone,63241,12511,[],[],True,False
42,2017-03-14 15:00:25,"JOBS, JOBS, JOBS! https://t.co/wAkQMKdPXA",Twitter for iPhone,99470,24886,[],[],False,True
43,2017-03-13 22:54:16,"Meeting w/ Washington, D.C. @MayorBowser and Metro GM Paul Wiedefeld about incoming winter storm preparations here… https://t.co/mg0A4Hq3bD",Twitter for iPhone,48593,8105,[],[u'Mayor Muriel Bowser'],True,False
44,2017-03-13 20:57:02,Proud to welcome our great Cabinet this afternoon for our first meeting. Unfortunately 4 seats were empty because S… https://t.co/bMYph832hF,Twitter for iPhone,72276,15919,[],[],True,False
45,2017-03-13 17:20:15,Healthcare listening session w/ @VP &amp; @SecPriceMD. Watch: https://t.co/5ayQ4dr8Ip #ReadTheBill:… https://t.co/1cQI0ZBUv8,Twitter for iPhone,38949,6873,[u'ReadTheBill'],"[u'Vice President Pence', u'Tom Price, M.D.']",True,False
46,2017-03-13 13:11:17,"ObamaCare is imploding. It is a disaster and 2017 will be the worst year yet, by far! Republicans will come together and save the day.",Twitter for iPhone,58526,10479,[],[],False,False
47,2017-03-13 12:52:29,"It is amazing how rude much of the media is to my very hard working representatives. Be nice, you will do much better!",Twitter for iPhone,101239,19664,[],[],False,False
48,2017-03-12 12:36:59,"RT @AmericaFirstPol: .@POTUS Trump led a historic journey to the White House. 50 days in, that historic journey continues. Take a look 👉 ht…",Twitter for iPhone,0,6878,[],"[u'AmericaFirstPolicies', u'President Trump']",False,False
49,2017-03-11 14:39:07,We are making great progress with healthcare. ObamaCare is imploding and will only get worse. Republicans coming together to get job done!,Twitter for iPhone,104525,16612,[],[],False,False
50,2017-03-10 15:40:53,"Weekly Address - 11:00 A.M. at the @WhiteHouse! #MAGA🇺🇸
➡️https://t.co/YSaPJnSX2i https://t.co/Gb8iTGzb6j",Twitter for iPhone,43134,8711,[u'MAGA'],[u'The White House'],True,True
51,2017-03-10 13:45:02,"RT @DRUDGE_REPORT: GREAT AGAIN:  +235,000 https://t.co/GkockGNdtC",Twitter for iPhone,0,7786,[],[u'DRUDGE REPORT'],True,False
52,2017-03-10 13:32:05,"RT @foxandfriends: ""Never give up....that's the worst thing you could do. There's always a chance."" -Kyle Coddington's message to those als…",Twitter for iPhone,0,9496,[],[u'FOX & friends'],False,False
53,2017-03-09 23:11:27,Honored to meet this years @SenateYouth delegates w/ @VP Pence in the East Room of the @WhiteHouse. Congratulations… https://t.co/oQIx7LybCV,Twitter for iPhone,56873,10588,[],"[u'Senate Youth', u'Vice President Pence', u'The White House']",True,False
54,2017-03-09 22:36:27,'U.S. Consumer Comfort Just Reached Its Highest Level in a Decade' ➡️https://t.co/S8nZgmeMMV https://t.co/xC0piRa6eP,Twitter for iPhone,67923,16303,[],[],True,True
55,2017-03-09 17:01:17,"Despite what you hear in the press, healthcare is coming along great. We are talking to many groups and it will end in a beautiful picture!",Twitter for iPhone,110687,19081,[],[],False,False
56,2017-03-09 13:13:54,RT @foxnation: .@realDonaldTrump's First Full Month in Office Sees Biggest Jobs Gain 'In Years': Report: https://t.co/rx4bgI1MWK,Twitter for iPhone,0,12430,[],"[u'Fox Nation', u'Donald J. Trump']",True,False
57,2017-03-08 23:54:16,"Great news. We are only just beginning. Together, we are going to #MAGA! https://t.co/BSp685Q9Qf https://t.co/K7yeBZsf6r",Twitter for iPhone,90839,22248,[u'MAGA'],[],True,True
58,2017-03-08 23:50:25,Met with @RepCummings today at the @WhiteHouse. Great discussion!,Twitter for iPhone,54615,7860,[],"[u'Elijah E. Cummings', u'The White House']",False,False
59,2017-03-08 12:11:25,LinkedIn Workforce Report: January and February were the strongest consecutive months for hiring since August and September 2015,Twitter for Android,85732,15947,[],[],False,False
60,2017-03-08 11:13:44,"On International Women's Day, join me in honoring the critical role of women here in America &amp; around the world.",Twitter for iPhone,116192,21966,[],[],False,False
61,2017-03-08 11:12:39,I have tremendous respect for women and the many roles they serve that are vital to the fabric of our society and our economy.,Twitter for iPhone,122056,23416,[],[],False,False
62,2017-03-08 00:14:30,I feel sure that my friend @RandPaul will come along with the new and great health care program because he knows Obamacare is a disaster!,Twitter for iPhone,82330,15662,[],[u'Senator Rand Paul'],False,False
63,2017-03-07 14:14:03,"Don't let the FAKE NEWS tell you that there is big infighting in the Trump Admin. We are getting along great, and getting major things done!",Twitter for Android,123280,26260,[],[],False,False
64,2017-03-07 13:46:28,I am working on a new system where there will be competition in the Drug Industry. Pricing for the American people will come way down!,Twitter for Android,125613,24040,[],[],False,False
65,2017-03-07 13:41:58,"Don't worry, getting rid of state lines, which will promote competition, will be in phase 2 &amp; 3 of healthcare rollout. @foxandfriends",Twitter for Android,83046,16613,[],[u'FOX & friends'],False,False
66,2017-03-07 13:13:20,"For eight years Russia ""ran over"" President Obama, got stronger and stronger, picked-off Crimea and added missiles. Weak! @foxandfriends",Twitter for Android,79677,17562,[],[u'FOX & friends'],False,False
67,2017-03-07 12:13:59,Our wonderful new Healthcare Bill is now out for review and negotiation. ObamaCare is a complete and total disaster - is imploding fast!,Twitter for Android,82298,15284,[],[],False,False
68,2017-03-07 12:04:13,"122 vicious prisoners, released by the Obama Administration from Gitmo, have returned to the battlefield. Just another terrible decision!",Twitter for Android,93654,23064,[],[],False,False
69,2017-03-07 03:50:49,"Thank you to @exxonmobil for your $20 billion investment that is creating more than 45,000 manufacturing &amp; construction jobs in the USA!",Twitter for iPhone,100454,19646,[],[u'ExxonMobil'],False,False
70,2017-03-07 03:49:54,"Buy American &amp; hire American are the principles at the core of my agenda, which is: JOBS, JOBS, JOBS! Thank you @exxonmobil.",Twitter for iPhone,88032,16399,[],[u'ExxonMobil'],False,False
71,2017-03-06 23:49:53,There is an incredible spirit of optimism sweeping the country right now—we're bringing back the JOBS! https://t.co/BNSLvKiEVj,Twitter for iPhone,109503,25278,[],[],False,True
72,2017-03-06 21:22:15,"45,000 construction &amp; manufacturing jobs in the U.S. Gulf Coast region. $20 billion investment. We are already winning again, America!",Twitter for iPhone,117992,24971,[],[],False,False
73,2017-03-06 21:19:04,"'President Trump Congratulates Exxon Mobil for Job-Creating Investment Program'
https://t.co/adBzWhtq8S",Twitter for iPhone,71319,12973,[],[],True,False
74,2017-03-05 17:30:11,Thank you for the great rallies all across the country. Tremendous support. Make America Great Again!,Twitter for iPhone,174282,31256,[],[],False,False
75,2017-03-05 11:40:20,"Who was it that secretly said to Russian President, ""Tell Vladimir that after the election I'll have more flexibility?"" @foxandfriends",Twitter for Android,127573,36981,[],[u'FOX & friends'],False,False
76,2017-03-05 11:32:22,Is it true the DNC would not allow the FBI access to check server or other equipment after learning it was hacked? Can that be possible?,Twitter for Android,97436,24748,[],[],False,False
77,2017-03-04 13:19:29,"Arnold Schwarzenegger isn't voluntarily leaving the Apprentice, he was fired by his bad (pathetic) ratings, not by me. Sad end to great show",Twitter for Android,108170,23548,[],[],False,False
78,2017-03-04 12:02:48,How low has President Obama gone to tapp my phones during the very sacred election process. This is Nixon/Watergate. Bad (or sick) guy!,Twitter for Android,164313,53503,[],[],False,False
79,2017-03-04 11:52:54,"I'd bet a good lawyer could make a great case out of the fact that President Obama was tapping my phones in October, just prior to Election!",Twitter for Android,133299,37719,[],[],False,False
80,2017-03-04 11:49:00,"Is it legal for a sitting President to be ""wire tapping"" a race for president prior to an election? Turned down by court earlier. A NEW LOW!",Twitter for Android,125010,36903,[],[],False,False
81,2017-03-04 11:42:59,"Just out: The same Russian Ambassador that met Jeff Sessions visited the Obama White House 22 times, and 4 times last year alone.",Twitter for Android,122518,37983,[],[],False,False
82,2017-03-04 11:35:20,"Terrible! Just found out that Obama had my ""wires tapped"" in Trump Tower just before the victory. Nothing found. This is McCarthyism!",Twitter for Android,145175,51154,[],[],False,False
83,2017-03-04 11:26:47,The first meeting Jeff Sessions had with the Russian Amb was set up by the Obama Administration under education program for 100 Ambs......,Twitter for Android,89149,24750,[],[],False,False
84,2017-03-03 22:13:10,MAKE AMERICA GREAT AGAIN! https://t.co/kuQiZDz4rA,Twitter for iPhone,123543,35713,[],[],False,True
85,2017-03-03 21:02:23,"I hereby demand a second investigation, after Schumer, of Pelosi for her close ties to Russia, and lying about it. https://t.co/qCDljfF3wN",Twitter for iPhone,123318,40370,[],[],True,False
86,2017-03-03 20:48:21,We must fix our education system for our kids to Make America Great Again. Wonderful day at Saint Andrew in Orlando. https://t.co/OTJaHcvLzf,Twitter for iPhone,83975,16698,[],[],False,True
87,2017-03-03 17:54:30,We should start an immediate investigation into @SenSchumer and his ties to Russia and Putin. A total hypocrite! https://t.co/Ik3yqjHzsA,Twitter for iPhone,151675,54771,[],[u'Chuck Schumer'],False,True
88,2017-03-03 16:41:55,"Weekly Address
Join me here: https://t.co/SEavQK5zy5 https://t.co/EnyXYeqgcp",Twitter for iPhone,54584,10314,[],[],True,True
89,2017-03-03 12:19:12,It is so pathetic that the Dems have still not approved my full Cabinet.,Twitter for Android,138532,28233,[],[],False,False
90,2017-03-03 12:00:39,"Nick Adams new book, Green Card Warrior, is a must read. The merit-based system is the way to go. Canada, Australia! @foxandfriends",Twitter for Android,67401,13987,[],[u'FOX & friends'],False,False
91,2017-03-03 02:38:48,"...is all of the illegal leaks of classified and other information. It is a total ""witch hunt!""",Twitter for Android,94502,18340,[],[],False,False
92,2017-03-03 02:35:33,"...to win. The Democrats are overplaying their hand. They lost the election, and now they have lost their grip on reality. The real story...",Twitter for Android,111375,23524,[],[],False,False
93,2017-03-03 02:27:29,...intentional. This whole narrative is a way of saving face for Democrats losing an election that everyone thought they were supposed.....,Twitter for Android,91603,17718,[],[],False,False
94,2017-03-03 02:22:49,"Jeff Sessions is an honest man. He did not say anything wrong. He could have stated his response more accurately, but it was clearly not....",Twitter for Android,103745,20062,[],[],False,False
95,2017-03-02 11:00:41,"Since November 8th, Election Day, the Stock Market has posted $3.2 trillion in GAINS and consumer confidence is at a 15 year high. Jobs!",Twitter for Android,177844,37697,[],[],False,False
96,2017-03-01 13:38:44,THANK YOU!,Twitter for Android,186816,27871,[],[],False,False
97,2017-03-01 01:42:16,"#JointSession #MAGA🇺🇸
https://t.co/RDO6Jt2pip",Twitter for iPhone,64521,10303,"[u'JointSession', u'MAGA']",[],True,False
98,2017-03-01 01:30:49,"Join me live at 9:00 P.M. 
#JointAddress https://t.co/J882zbyVkJ https://t.co/gTtK3vJmkU",Twitter for iPhone,55518,7472,[u'JointAddress'],[],True,True
99,2017-02-28 02:43:03,I will be interviewed on @foxandfriends at 6:00 A.M. Enjoy!,Twitter for Android,84005,11162,[],[u'FOX & friends'],False,False
100,2017-02-27 21:48:21,"GOP now viewed more favorably than Dems, in Trump era (per NBC/WSJ poll) via @HotlineJosh:
https://t.co/Soebxtg2Zd",Twitter for iPhone,71556,14867,[],[u'Josh Kraushaar'],True,False
101,2017-02-27 17:06:23,Great meeting with CEOs of leading U.S. health insurance companies who provide great healthcare to the American peo… https://t.co/60jigi6ffS,Twitter for iPhone,90729,15572,[],[],True,False
102,2017-02-26 20:13:52,"Big dinner with Governors tonight at White House. Much to be discussed, including healthcare.",Twitter for Android,107498,15963,[],[],False,False
103,2017-02-26 18:16:41,"Russia talk is FAKE NEWS put out by the Dems, and played up by the media, in order to mask the big election defeat and the illegal leaks!",Twitter for Android,115004,25010,[],[],False,False
104,2017-02-26 11:42:39,For first time the failing @nytimes will take an ad (a bad one) to help save its failing reputation. Try reporting accurately &amp; fairly!,Twitter for Android,111150,22117,[],[u'The New York Times'],False,False
105,2017-02-26 11:33:16,"The race for DNC Chairman was, of course, totally ""rigged."" Bernie's guy, like Bernie himself, never had a chance. Clinton demanded Perez!",Twitter for Android,88598,19393,[],[],False,False
106,2017-02-25 22:02:22,"Congratulations to Thomas Perez, who has just been named Chairman of the DNC. I could not be happier for him, or for the Republican Party!",Twitter for Android,132770,29311,[],[],False,False
107,2017-02-25 21:53:21,I will not be attending the White House Correspondents' Association Dinner this year. Please wish everyone well and have a great evening!,Twitter for Android,125988,24259,[],[],False,False
108,2017-02-25 18:12:25,Weekly Address from @WhiteHouse: https://t.co/uaoQSHBOQB https://t.co/7eF6aC6kEC,Twitter for iPhone,46435,10188,[],[u'The White House'],True,True
109,2017-02-25 13:27:04,"Great optimism for future of U.S. business, AND JOBS, with the DOW having an 11th straight record close. Big tax &amp; regulation cuts coming!",Twitter for Android,105487,20050,[],[],False,False
110,2017-02-25 13:19:18,The media has not reported that the National Debt in my first month went down by $12 billion vs a $200 billion increase in Obama first mo.,Twitter for Android,203706,62439,[],[],False,False
111,2017-02-25 12:25:24,Maybe the millions of people who voted to MAKE AMERICA GREAT AGAIN should have their own rally. It would be the biggest of them all!,Twitter for Android,160910,35045,[],[],False,False
112,2017-02-25 03:09:18,FAKE NEWS media knowingly doesn't tell the truth. A great danger to our country. The failing @nytimes has become a joke. Likewise @CNN. Sad!,Twitter for Android,110512,26737,[],"[u'The New York Times', u'CNN']",False,False
113,2017-02-24 17:04:19,"Trump vows to fight 'epidemic' of human trafficking 
https://t.co/oDLZ2NdrtA",Twitter for iPhone,92271,20506,[],[],True,False
114,2017-02-24 13:49:27,Going to CPAC!,Twitter for Android,72842,9067,[],[],False,False
115,2017-02-24 12:36:34,find the leakers within the FBI itself. Classified information is being given to media that could have a devastating effect on U.S. FIND NOW,Twitter for Android,102049,21953,[],[],False,False
116,2017-02-24 12:31:49,"The FBI is totally unable to stop the national security ""leakers"" that have permeated our government for a long time. They can't even......",Twitter for Android,81461,17874,[],[],False,False
117,2017-02-24 00:06:44,Big interview tonight by Henry Kravis at The Business Council of Washington. Looking forward to it!,Twitter for Android,58989,8381,[],[],False,False
118,2017-02-24 00:01:40,Seven people shot and killed yesterday in Chicago. What is going on there - totally out of control. Chicago needs help!,Twitter for Android,109948,23553,[],[],False,False
119,2017-02-23 22:53:45,'S&amp;P 500 Edges Higher After Trump Renews Jobs Pledge' https://t.co/WtrRJVFmvU,Twitter for iPhone,57028,10705,[],[],True,False
120,2017-02-22 12:50:56,Very much enjoyed my tour of the Smithsonian's National Museum of African American History and Culture...A great job done by amazing people!,Twitter for Android,118253,16445,[],[],False,False
121,2017-02-22 12:20:40,"One thing I will say about Rep. Keith Ellison, in his fight to lead the DNC, is that he was the one who predicted early that I would win!",Twitter for Android,80477,12320,[],[],False,False
122,2017-02-21 23:23:13,"The so-called angry crowds in home districts of some Republicans are actually, in numerous cases, planned out by liberal activists. Sad!",Twitter for Android,120088,26466,[],[],False,False
123,2017-02-21 20:46:42,'Americans overwhelmingly oppose sanctuary cities' https://t.co/s5QvsJWA6u,Twitter for iPhone,108583,23989,[],[],True,False
124,2017-02-21 00:38:40,"Congratulations to our new National Security Advisor, General H.R. McMaster. Video: https://t.co/BKn9r225Kk https://t.co/VBXcJ1b6Pv",Twitter for iPhone,95394,16253,[],[],True,True
125,2017-02-20 21:00:37,Just named General H.R. McMaster National Security Advisor.,Twitter for Android,107879,16027,[],[],False,False
126,2017-02-20 14:33:33,HAPPY PRESIDENTS DAY - MAKE AMERICA GREAT AGAIN!,Twitter for Android,245979,49744,[],[],False,False
127,2017-02-20 14:15:42,Give the public a break - The FAKE NEWS media is trying to say that large scale immigration in Sweden is working out just beautifully. NOT!,Twitter for Android,143442,35563,[],[],False,False
128,2017-02-19 21:57:01,My statement as to what's happening in Sweden was in reference to a story that was broadcast on @FoxNews concerning immigrants &amp; Sweden.,Twitter for Android,114082,26666,[],[u'Fox News'],False,False
